{
  "api_version": "epoch/v1alpha1",
  "name": "agent-authority-before-expiry",
  "image": "epoch-agent-authority-expiry-v1",
  "workload": "agent-authority-expiry",
  "resources": {
    "vcpu_count": 1,
    "memory_mib": 512
  },
  "timeout_ms": 120000,
  "boot_timeout_ms": 30000,
  "steps": [
    {
      "id": "before-expiry",
      "op": "clock.set",
      "at": "2035-01-01T12:00:29Z",
      "tolerance_ms": 100
    },
    {
      "id": "restart",
      "op": "action.exec",
      "action": "attempt",
      "input": {
        "request_id": "restart-before-expiry",
        "agent_id": "incident-agent-01",
        "operation": "worker.restart",
        "resource": "worker-17",
        "authority": {
          "principal": "agent://incident-agent-01",
          "capability": "worker.restart",
          "resource": "worker-17",
          "not_before": "2035-01-01T12:00:00Z",
          "expires_at": "2035-01-01T12:00:30Z"
        }
      },
      "timeout_ms": 5000
    }
  ],
  "assertions": [
    {
      "id": "initially-authorized",
      "step": "restart",
      "pointer": "/stdout_json/initial_authorization",
      "op": "eq",
      "value": "AUTHORIZED"
    },
    {
      "id": "authorized-at-execution",
      "step": "restart",
      "pointer": "/stdout_json/execution_authorization",
      "op": "eq",
      "value": "AUTHORIZED"
    },
    {
      "id": "request-accepted",
      "step": "restart",
      "pointer": "/stdout_json/request_accepted",
      "op": "eq",
      "value": true
    },
    {
      "id": "restart-simulated",
      "step": "restart",
      "pointer": "/stdout_json/side_effect_performed",
      "op": "eq",
      "value": true
    },
    {
      "id": "local-state-updated",
      "step": "restart",
      "pointer": "/stdout_json/worker_state/restart_count",
      "op": "eq",
      "value": 1
    }
  ]
}
